{
  "generated_at": "2026-10-14T04:56:49.606701+00:00",
  "global_invariants": [
    {
      "check": "check_no_overwrite",
      "description": "Cannot modify approved outline",
      "id": "inv.golden.no_overwrite",
      "source_workflow": "draft-outline"
    }
  ],
  "negative_boundaries": {
    "golden-writer": {
      "cannot_modify": [
        "approved_outline"
      ],
      "cannot_trigger_state_transition": [
        "release_to_production"
      ]
    }
  },
  "version": "2026.10.14"
}
